{
  "$schema": "https://json-schema.org/draft/2020-12/schema",
  "$id": "https://multiscale-optics-agent.local/schemas/performance.schema.json",
  "title": "Performance baseline record (CHE-105 / M0.4)",
  "description": "One measured workload. `environment` is what decides whether two of these may be compared at all; `workload.unit` and `workload.route` are what decide whether the comparison means anything, because cost per ray is a different quantity on an O(rays x pixels) route than on an O(rays) + FFT route.",
  "type": "object",
  "additionalProperties": false,
  "required": [
    "label",
    "workload",
    "measurement",
    "cost_per_unit",
    "cost_per_unit_name",
    "environment",
    "isolation",
    "stages",
    "peak_host_rss_bytes",
    "cuda",
    "swap_growth_bytes",
    "memory_report",
    "notes"
  ],
  "properties": {
    "label": {"type": "string", "minLength": 1},

    "workload": {
      "type": "object",
      "additionalProperties": false,
      "required": ["size", "unit", "route", "detail"],
      "properties": {
        "size": {
          "type": "number",
          "exclusiveMinimum": 0,
          "description": "How much work, in its natural unit. Never 'one run'."
        },
        "unit": {"type": "string", "minLength": 1},
        "route": {
          "type": ["string", "null"],
          "description": "Anything that changes the asymptotic cost model. Two records with the same unit and different routes are not comparable."
        },
        "detail": {"type": "object"}
      }
    },

    "measurement": {
      "type": "object",
      "additionalProperties": false,
      "required": ["repeats", "warmup", "median_s", "min_s", "p95_s", "all_s", "tail_rule"],
      "properties": {
        "repeats": {"type": "integer", "minimum": 1},
        "warmup": {"type": "integer", "minimum": 0},
        "median_s": {"type": "number", "exclusiveMinimum": 0},
        "min_s": {"type": "number", "exclusiveMinimum": 0},
        "p95_s": {
          "type": "number",
          "exclusiveMinimum": 0,
          "description": "NOT an interpolated percentile. The index is ceil(0.95n)-1, which is the slowest observed run for every n <= 19 and the second-slowest at n = 20. Read `tail_rule` rather than the field name: at the repeat counts this harness uses, a field called p95_s holds the max of 3."
        },
        "all_s": {"type": "array", "minItems": 1, "items": {"type": "number"}},
        "tail_rule": {
          "type": "string",
          "pattern": "^(max_of_[0-9]+|order_statistic_[0-9]+_of_[0-9]+)$",
          "description": "How p95_s was actually obtained, machine-readable, so the rule travels with the number instead of living only in this schema."
        }
      }
    },

    "cost_per_unit": {"type": ["number", "null"]},
    "cost_per_unit_name": {"type": "string"},

    "environment": {
      "type": "object",
      "additionalProperties": false,
      "required": [
        "python_version",
        "platform",
        "cpu_model",
        "logical_cpus",
        "thread_env",
        "container_image",
        "gpu_name",
        "gpu_driver",
        "gpu_count",
        "visible_devices",
        "packages",
        "sha256"
      ],
      "properties": {
        "python_version": {"type": "string"},
        "platform": {"type": "string"},
        "cpu_model": {"type": ["string", "null"]},
        "logical_cpus": {"type": ["integer", "null"]},
        "thread_env": {"type": "object", "additionalProperties": {"type": "string"}},
        "container_image": {"type": "string"},
        "gpu_name": {"type": ["string", "null"]},
        "gpu_driver": {"type": ["string", "null"]},
        "gpu_count": {
          "type": ["integer", "null"],
          "minimum": 0,
          "description": "Visible CUDA devices. AGENTS.md requires GPU measurements to be single-GPU; a count of 1 read from the runtime is what makes that checkable."
        },
        "visible_devices": {"type": ["string", "null"]},
        "packages": {"type": "object", "additionalProperties": {"type": "string"}},
        "sha256": {"type": "string", "pattern": "^[0-9a-f]{64}$"}
      }
    },

    "isolation": {
      "type": "object",
      "additionalProperties": false,
      "required": ["applied", "cpu_affinity", "thread_env", "logical_cpus"],
      "properties": {
        "applied": {
          "type": "boolean",
          "description": "False unless something actually pinned threads or affinity. Recording an affinity mask does not make a run isolated."
        },
        "cpu_affinity": {"type": "array", "items": {"type": "integer", "minimum": 0}},
        "thread_env": {"type": "object", "additionalProperties": {"type": "string"}},
        "logical_cpus": {"type": ["integer", "null"]}
      }
    },

    "stages": {
      "type": ["object", "null"],
      "description": "Per-stage wall clock and each stage's share of the total. The share is the number CHE-101 needed: a 9.6x speedup on a stage worth 7% of the run moves the run by 7%.",
      "additionalProperties": true,
      "properties": {
        "seconds": {"type": "object", "additionalProperties": {"type": "number"}},
        "accounted_s": {"type": "number"},
        "fraction_of_total": {
          "type": "object",
          "description": "Each stage's share of `total_s`, which is the elapsed time of the SAME call the stages were timed in -- not a median over repeats. A share above 1 is refused at write time rather than published.",
          "additionalProperties": {"type": "number", "minimum": 0, "maximum": 1.001}
        },
        "unaccounted_s": {"type": "number"},
        "total_s": {
          "type": "number",
          "exclusiveMinimum": 0,
          "description": "The denominator of `fraction_of_total`: the elapsed seconds of the repeat whose stage timer this is. Present so a reader can check the shares rather than trust them."
        }
      }
    },

    "peak_host_rss_bytes": {"type": ["integer", "null"], "minimum": 0},

    "cuda": {
      "type": ["object", "null"],
      "description": "This process's CUDA allocator state. `null` when the workload ran in a child process: a parent's snapshot is not the child's peak, and reporting the parent's zeros would read as 'the workload used no GPU memory'. For a whole-command baseline, the device memory is in the measured probe's own record.",
      "additionalProperties": true,
      "required": ["available"],
      "properties": {
        "available": {"type": "boolean"},
        "device": {"type": ["string", "null"]},
        "peak_allocated_bytes": {"type": ["integer", "null"]},
        "peak_reserved_bytes": {"type": ["integer", "null"]}
      }
    },

    "swap_growth_bytes": {
      "type": ["integer", "null"],
      "minimum": 0,
      "description": "Growth in the container cgroup's swap over the measurement. Nonzero means the run was aborted: swap as working memory is a stop condition, not a footnote. `null` means the cgroup file could not be read, which is reported rather than treated as zero."
    },

    "memory_report": {"type": ["object", "null"], "additionalProperties": true},

    "notes": {"type": "array", "items": {"type": "string"}},

    "subprocess": {
      "type": "object",
      "description": "Present when the measured thing was a whole command rather than an in-process callable. The argv is part of the record because 'the test suite' is not a fixed workload -- it is whatever that command selects on the day.",
      "additionalProperties": false,
      "required": ["argv", "returncode", "tail", "stderr_tail"],
      "properties": {
        "argv": {"type": "array", "minItems": 1, "items": {"type": "string"}},
        "returncode": {
          "const": 0,
          "description": "Zero, always. A nonzero exit is refused by the runner rather than recorded: timing how long something took to crash and committing it as a baseline is worse than having no baseline."
        },
        "tail": {"type": "array", "items": {"type": "string"}},
        "stderr_tail": {"type": "array", "items": {"type": "string"}},
        "peak_child_rss_bytes": {
          "type": ["integer", "null"],
          "minimum": 0,
          "description": "Peak RSS of the measured child, from ru_maxrss over waited-for children. This is the workload's memory; the top-level `peak_host_rss_bytes` is the PARENT's and describes nothing about a whole-command baseline. `null` when the counter did not rise above the high-water mark left by an earlier child in this process."
        }
      }
    }
  }
}
