{
 "cost_per_unit": 5.978677765937391e-07,
 "cost_per_unit_name": "seconds_per_ray [ramp_sum]",
 "cuda": null,
 "environment": {
  "container_image": "agent_solver",
  "cpu_model": "Intel(R) Xeon(R) Gold 6242R CPU @ 3.10GHz",
  "gpu_count": 1,
  "gpu_driver": "550.163.01",
  "gpu_name": "NVIDIA RTX A6000",
  "logical_cpus": 80,
  "packages": {
   "chromatix": "0.6.0",
   "jax": "0.6.2",
   "jaxlib": "0.6.2",
   "numpy": "2.2.6",
   "optiland": "0.6.0",
   "scipy": "1.15.3",
   "torch": "2.13.0+cu126"
  },
  "platform": "Linux-6.8.0-84-generic-x86_64-with-glibc2.41",
  "python_version": "3.12.14",
  "sha256": "fb66d7be8b4ad129b5e05807f3af88645c4e8aff3559a03e6d76914ed0d29f11",
  "thread_env": {},
  "visible_devices": null
 },
 "isolation": {
  "applied": false,
  "cpu_affinity": [
   0,
   1,
   2,
   3,
   4,
   5,
   6,
   7,
   8,
   9,
   10,
   11,
   12,
   13,
   14,
   15,
   16,
   17,
   18,
   19,
   20,
   21,
   22,
   23,
   24,
   25,
   26,
   27,
   28,
   29,
   30,
   31,
   32,
   33,
   34,
   35,
   36,
   37,
   38,
   39,
   40,
   41,
   42,
   43,
   44,
   45,
   46,
   47,
   48,
   49,
   50,
   51,
   52,
   53,
   54,
   55,
   56,
   57,
   58,
   59,
   60,
   61,
   62,
   63,
   64,
   65,
   66,
   67,
   68,
   69,
   70,
   71,
   72,
   73,
   74,
   75,
   76,
   77,
   78,
   79
  ],
  "logical_cpus": 80,
  "thread_env": {}
 },
 "label": "demo2_paper_rw_p_ramp_sum_cuda",
 "measurement": {
  "all_s": [
   95.65884425499826
  ],
  "median_s": 95.65884425499826,
  "min_s": 95.65884425499826,
  "p95_s": 95.65884425499826,
  "repeats": 1,
  "tail_rule": "max_of_1",
  "warmup": 0
 },
 "memory_report": {
  "after": {
   "cgroup_memory_bytes": 31330304,
   "cgroup_swap_bytes": 0,
   "host_swap_total_bytes": 2002545270784,
   "host_swap_used_bytes": 0,
   "mem_available_bytes": 390017241088,
   "mem_total_bytes": 405342146560,
   "monotonic_s": 100337.747270587,
   "rss_bytes": 30801920
  },
  "before": {
   "cgroup_memory_bytes": 20430848,
   "cgroup_swap_bytes": 0,
   "host_swap_total_bytes": 2002545270784,
   "host_swap_used_bytes": 0,
   "mem_available_bytes": 389857218560,
   "mem_total_bytes": 405342146560,
   "monotonic_s": 100242.086353825,
   "rss_bytes": 30801920
  },
  "cgroup_swap_after_bytes": 0,
  "cgroup_swap_before_bytes": 0,
  "host_reserve_bytes": 60801321984,
  "interval_s": 0.25,
  "min_mem_available_bytes": 386720616448,
  "peak_cgroup_swap_bytes": 0,
  "peak_rss_bytes": 30801920,
  "process_rss_budget_bytes": null,
  "samples": 383,
  "signal": "/sys/fs/cgroup/memory.swap.current",
  "signal_rationale": "container cgroup swap, not host swap: host swap is non-zero at rest on this machine (CHE-64), so a host-swap delta is not attributable to this run",
  "swap_delta_peak_bytes": 0,
  "verdict": {
   "breached": false,
   "detail": null,
   "limit_bytes": null,
   "observed_bytes": null,
   "reason": null
  }
 },
 "notes": [
  "One timed run, no warmup. Three repeats of this configuration is minutes of a shared GPU to improve a number that varies by a few percent.",
  "seconds_per_ray is route-specific: ramp_sum is O(rays x pixels) and kspace_splat is O(rays) + one FFT, so the two are not one number. core.performance.compare refuses to divide them.",
  "The demo's own record is at benchmarks/probes/records/ray_wave/perf_demo2_paper_rw_p_ramp_sum_cuda.json -- written under a perf_ name so this timing run does not overwrite a committed scientific record.",
  "Measured across a process boundary, so this process does not touch a device: initializing JAX here would preallocate ~78% of the card and leave the child to OOM on an allocation it has room for alone. The process boundary is the barrier, and `cuda` is null because a parent's allocator snapshot is not the child's peak -- read the demo's own record for its device memory."
 ],
 "peak_host_rss_bytes": 30801920,
 "stages": {
  "accounted_s": 95.658,
  "fraction_of_total": {
   "subprocess": 1.0
  },
  "seconds": {
   "subprocess": 95.658
  },
  "total_s": 95.6588,
  "unaccounted_s": 0.0008
 },
 "subprocess": {
  "argv": [
   "/usr/local/bin/python",
   "/workspace/benchmarks/probes/ray_wave/demo2_hologram.py",
   "--preset",
   "paper",
   "--routes",
   "rw_p",
   "--reconstruction",
   "ramp_sum",
   "--backend",
   "jax",
   "--output-name",
   "perf_demo2_paper_rw_p_ramp_sum_cuda"
  ],
  "peak_child_rss_bytes": 2748047360,
  "returncode": 0,
  "stderr_tail": [],
  "tail": [
   "wrote /workspace/benchmarks/probes/records/ray_wave/perf_demo2_paper_rw_p_ramp_sum_cuda.json",
   "  rw_p: NCC 0.999418  rel-L2 2.8562e-02  rays 160,000,000  92.77 s"
  ]
 },
 "swap_growth_bytes": 0,
 "workload": {
  "detail": {
   "backend": "jax",
   "declared_rays": 160000000.0,
   "preset": "paper",
   "rays_read_from": "perf_demo2_paper_rw_p_ramp_sum_cuda.json",
   "routes": "rw_p"
  },
  "route": "ramp_sum",
  "size": 160000000.0,
  "unit": "ray"
 }
}
