{
 "cost_per_unit": 48.58730137400562,
 "cost_per_unit_name": "seconds_per_instance_run [GraphExecutor + verify()]",
 "cuda": null,
 "environment": {
  "container_image": "agent_solver",
  "cpu_model": "Intel(R) Xeon(R) Gold 6242R CPU @ 3.10GHz",
  "gpu_count": null,
  "gpu_driver": null,
  "gpu_name": null,
  "logical_cpus": 80,
  "packages": {
   "chromatix": "0.6.0",
   "jax": "0.6.2",
   "jaxlib": "0.6.2",
   "numpy": "2.2.6",
   "optiland": "0.6.0",
   "scipy": "1.15.3",
   "torch": "2.13.0+cpu"
  },
  "platform": "Linux-6.8.0-84-generic-x86_64-with-glibc2.41",
  "python_version": "3.12.14",
  "sha256": "8a536c6653510329b7cd2da8eb9da82cb94e8a2a420ab4765315dbd8684313ad",
  "thread_env": {},
  "visible_devices": null
 },
 "isolation": {
  "applied": false,
  "cpu_affinity": [
   0,
   1,
   2,
   3,
   4,
   5,
   6,
   7,
   8,
   9,
   10,
   11,
   12,
   13,
   14,
   15,
   16,
   17,
   18,
   19,
   20,
   21,
   22,
   23,
   24,
   25,
   26,
   27,
   28,
   29,
   30,
   31,
   32,
   33,
   34,
   35,
   36,
   37,
   38,
   39,
   40,
   41,
   42,
   43,
   44,
   45,
   46,
   47,
   48,
   49,
   50,
   51,
   52,
   53,
   54,
   55,
   56,
   57,
   58,
   59,
   60,
   61,
   62,
   63,
   64,
   65,
   66,
   67,
   68,
   69,
   70,
   71,
   72,
   73,
   74,
   75,
   76,
   77,
   78,
   79
  ],
  "logical_cpus": 80,
  "thread_env": {}
 },
 "label": "B3-PSF-SINGLET-01 through the executor",
 "measurement": {
  "all_s": [
   48.58730137400562
  ],
  "median_s": 48.58730137400562,
  "min_s": 48.58730137400562,
  "p95_s": 48.58730137400562,
  "repeats": 1,
  "tail_rule": "max_of_1",
  "warmup": 0
 },
 "memory_report": {
  "after": {
   "cgroup_memory_bytes": 286281728,
   "cgroup_swap_bytes": 0,
   "host_swap_total_bytes": 2002545270784,
   "host_swap_used_bytes": 0,
   "mem_available_bytes": 379780354048,
   "mem_total_bytes": 405342146560,
   "monotonic_s": 344343.994453485,
   "rss_bytes": 30314496
  },
  "before": {
   "cgroup_memory_bytes": 19841024,
   "cgroup_swap_bytes": 0,
   "host_swap_total_bytes": 2002545270784,
   "host_swap_used_bytes": 0,
   "mem_available_bytes": 380267708416,
   "mem_total_bytes": 405342146560,
   "monotonic_s": 344295.405653978,
   "rss_bytes": 30314496
  },
  "cgroup_swap_after_bytes": 0,
  "cgroup_swap_before_bytes": 0,
  "host_reserve_bytes": 60801321984,
  "interval_s": 0.25,
  "min_mem_available_bytes": 368063090688,
  "peak_cgroup_swap_bytes": 0,
  "peak_rss_bytes": 30314496,
  "process_rss_budget_bytes": null,
  "samples": 195,
  "signal": "/sys/fs/cgroup/memory.swap.current",
  "signal_rationale": "container cgroup swap, not host swap: host swap is non-zero at rest on this machine (CHE-64), so a host-swap delta is not attributable to this run",
  "swap_delta_peak_bytes": 0,
  "verdict": {
   "breached": false,
   "detail": null,
   "limit_bytes": null,
   "observed_bytes": null,
   "reason": null
  }
 },
 "notes": [
  "One timed run, no warmup, for the same reason as the suite baseline.",
  "Includes the opl-sign-flip control, which is a second 512-ring execution of the same graph: this is the cost of the committed record, not of the cheapest way to get the number.",
  "Measured across a process boundary, so this process does not touch a device: initializing JAX here would preallocate ~78% of the card and leave the child to OOM on an allocation it has room for alone. The process boundary is the barrier, and `cuda` is null because a parent's allocator snapshot is not the child's peak -- read the demo's own record for its device memory."
 ],
 "peak_host_rss_bytes": 30314496,
 "stages": {
  "accounted_s": 48.5871,
  "fraction_of_total": {
   "subprocess": 1.0
  },
  "seconds": {
   "subprocess": 48.5871
  },
  "total_s": 48.5873,
  "unaccounted_s": 0.0002
 },
 "subprocess": {
  "argv": [
   "/usr/local/bin/python",
   "/workspace/benchmarks/instances/b3_psf_singlet.py"
  ],
  "peak_child_rss_bytes": 12191825920,
  "returncode": 0,
  "stderr_tail": [],
  "tail": [
   "  control launch-phase-error: not_run  declared and not run here. On axis the term is a constant and cancels, so this control is only meaningful off axis; B1-RAY-OFFAXIS-OPL owns it at the node level, where it can be isolated from the propagation",
   "gate trustworthy: False",
   "  [metric_missing_from_record] the family declares o2_asm_intensity_relative_l2 and the run measured none",
   "  [negative_control_not_run] inverted-quadrature-weight was not exercised -- and it is the control already known to fire backwards",
   "  [negative_control_not_run] axis-transpose was not exercised",
   "  [negative_control_not_run] launch-phase-error was not exercised",
   "  [convergence_not_established] the family declares a refinement dimension and this run carries no ladder, so the value is a single point rather than a converged one",
   "scientific fingerprint: 7f90cc04533ca976bb124f132aebfc2c34949019cbbb667be51740ef36b2eb2e"
  ]
 },
 "swap_growth_bytes": 0,
 "workload": {
  "detail": {},
  "route": "GraphExecutor + verify()",
  "size": 1.0,
  "unit": "instance_run"
 }
}
