{
 "cost_per_unit": 3.5325351477501194e-06,
 "cost_per_unit_name": "seconds_per_ray [ramp_sum]",
 "cuda": null,
 "environment": {
  "container_image": "agent_solver",
  "cpu_model": "Intel(R) Xeon(R) Gold 6242R CPU @ 3.10GHz",
  "gpu_count": 1,
  "gpu_driver": "550.163.01",
  "gpu_name": "NVIDIA RTX A6000",
  "logical_cpus": 80,
  "packages": {
   "chromatix": "0.6.0",
   "jax": "0.6.2",
   "jaxlib": "0.6.2",
   "numpy": "2.2.6",
   "optiland": "0.6.0",
   "scipy": "1.15.3",
   "torch": "2.13.0+cu126"
  },
  "platform": "Linux-6.8.0-84-generic-x86_64-with-glibc2.41",
  "python_version": "3.12.14",
  "sha256": "fb66d7be8b4ad129b5e05807f3af88645c4e8aff3559a03e6d76914ed0d29f11",
  "thread_env": {},
  "visible_devices": null
 },
 "isolation": {
  "applied": false,
  "cpu_affinity": [
   0,
   1,
   2,
   3,
   4,
   5,
   6,
   7,
   8,
   9,
   10,
   11,
   12,
   13,
   14,
   15,
   16,
   17,
   18,
   19,
   20,
   21,
   22,
   23,
   24,
   25,
   26,
   27,
   28,
   29,
   30,
   31,
   32,
   33,
   34,
   35,
   36,
   37,
   38,
   39,
   40,
   41,
   42,
   43,
   44,
   45,
   46,
   47,
   48,
   49,
   50,
   51,
   52,
   53,
   54,
   55,
   56,
   57,
   58,
   59,
   60,
   61,
   62,
   63,
   64,
   65,
   66,
   67,
   68,
   69,
   70,
   71,
   72,
   73,
   74,
   75,
   76,
   77,
   78,
   79
  ],
  "logical_cpus": 80,
  "thread_env": {}
 },
 "label": "demo3_characterization_rw_p_ramp_sum_cuda",
 "measurement": {
  "all_s": [
   211.95210886500718
  ],
  "median_s": 211.95210886500718,
  "min_s": 211.95210886500718,
  "p95_s": 211.95210886500718,
  "repeats": 1,
  "tail_rule": "max_of_1",
  "warmup": 0
 },
 "memory_report": {
  "after": {
   "cgroup_memory_bytes": 37384192,
   "cgroup_swap_bytes": 0,
   "host_swap_total_bytes": 2002545270784,
   "host_swap_used_bytes": 0,
   "mem_available_bytes": 390157434880,
   "mem_total_bytes": 405342146560,
   "monotonic_s": 100555.940793052,
   "rss_bytes": 30420992
  },
  "before": {
   "cgroup_memory_bytes": 20566016,
   "cgroup_swap_bytes": 0,
   "host_swap_total_bytes": 2002545270784,
   "host_swap_used_bytes": 0,
   "mem_available_bytes": 389732225024,
   "mem_total_bytes": 405342146560,
   "monotonic_s": 100343.986689886,
   "rss_bytes": 30420992
  },
  "cgroup_swap_after_bytes": 0,
  "cgroup_swap_before_bytes": 0,
  "host_reserve_bytes": 60801321984,
  "interval_s": 0.25,
  "min_mem_available_bytes": 387627175936,
  "peak_cgroup_swap_bytes": 0,
  "peak_rss_bytes": 30420992,
  "process_rss_budget_bytes": null,
  "samples": 846,
  "signal": "/sys/fs/cgroup/memory.swap.current",
  "signal_rationale": "container cgroup swap, not host swap: host swap is non-zero at rest on this machine (CHE-64), so a host-swap delta is not attributable to this run",
  "swap_delta_peak_bytes": 0,
  "verdict": {
   "breached": false,
   "detail": null,
   "limit_bytes": null,
   "observed_bytes": null,
   "reason": null
  }
 },
 "notes": [
  "One timed run, no warmup. Three repeats of this configuration is minutes of a shared GPU to improve a number that varies by a few percent.",
  "seconds_per_ray is route-specific: ramp_sum is O(rays x pixels) and kspace_splat is O(rays) + one FFT, so the two are not one number. core.performance.compare refuses to divide them.",
  "The demo's own record is at benchmarks/probes/records/ray_wave/perf_demo3_characterization_rw_p_ramp_sum_cuda.json -- written under a perf_ name so this timing run does not overwrite a committed scientific record.",
  "Measured across a process boundary, so this process does not touch a device: initializing JAX here would preallocate ~78% of the card and leave the child to OOM on an allocation it has room for alone. The process boundary is the barrier, and `cuda` is null because a parent's allocator snapshot is not the child's peak -- read the demo's own record for its device memory."
 ],
 "peak_host_rss_bytes": 30420992,
 "stages": {
  "accounted_s": 204.242,
  "fraction_of_total": {
   "emit_patch_spectra": 0.4094,
   "host_to_device": 0.0164,
   "optiland_trace": 0.4669,
   "power_bookkeeping": 0.0039,
   "reconstruct": 0.067
  },
  "seconds": {
   "emit_patch_spectra": 86.778,
   "host_to_device": 3.476,
   "optiland_trace": 98.956,
   "power_bookkeeping": 0.832,
   "reconstruct": 14.2
  },
  "source": "perf_demo3_characterization_rw_p_ramp_sum_cuda.json stage_wall_clock_s -- the demo's own per-stage timers, summed over chunks. The denominator is the whole command, which includes interpreter start, JAX compilation, the plan setup and the record write, so the unaccounted remainder is real and named rather than hidden.",
  "total_s": 211.9521,
  "unaccounted_s": 7.7101
 },
 "subprocess": {
  "argv": [
   "/usr/local/bin/python",
   "/workspace/benchmarks/probes/ray_wave/demo3_hologram_lens.py",
   "--preset",
   "characterization",
   "--routes",
   "rw_p",
   "--reconstruction",
   "ramp_sum",
   "--backend",
   "jax",
   "--output-name",
   "perf_demo3_characterization_rw_p_ramp_sum_cuda"
  ],
  "peak_child_rss_bytes": 2893557760,
  "returncode": 0,
  "stderr_tail": [],
  "tail": [
   "rw_p seed 20260822: 60,000,000 rays  205.40 s  empty 5,920,000  clipped 0",
   "wrote /workspace/benchmarks/probes/records/ray_wave/perf_demo3_characterization_rw_p_ramp_sum_cuda.json",
   "wrote /workspace/benchmarks/probes/records/ray_wave/perf_demo3_characterization_rw_p_ramp_sum_cuda_fields.npz"
  ]
 },
 "swap_growth_bytes": 0,
 "workload": {
  "detail": {
   "backend": "jax",
   "declared_rays": 60000000.0,
   "preset": "characterization",
   "rays_read_from": "perf_demo3_characterization_rw_p_ramp_sum_cuda.json",
   "routes": "rw_p"
  },
  "route": "ramp_sum",
  "size": 60000000.0,
  "unit": "ray"
 }
}
