{
 "cost_per_unit": 211.44416953199834,
 "cost_per_unit_name": "seconds_per_suite_run [pytest -q tests]",
 "cuda": null,
 "environment": {
  "container_image": "agent_solver",
  "cpu_model": "Intel(R) Xeon(R) Gold 6242R CPU @ 3.10GHz",
  "gpu_count": null,
  "gpu_driver": null,
  "gpu_name": null,
  "logical_cpus": 80,
  "packages": {
   "chromatix": "0.6.0",
   "jax": "0.6.2",
   "jaxlib": "0.6.2",
   "numpy": "2.2.6",
   "optiland": "0.6.0",
   "scipy": "1.15.3",
   "torch": "2.13.0+cpu"
  },
  "platform": "Linux-6.8.0-84-generic-x86_64-with-glibc2.41",
  "python_version": "3.12.14",
  "sha256": "8a536c6653510329b7cd2da8eb9da82cb94e8a2a420ab4765315dbd8684313ad",
  "thread_env": {},
  "visible_devices": null
 },
 "isolation": {
  "applied": false,
  "cpu_affinity": [
   0,
   1,
   2,
   3,
   4,
   5,
   6,
   7,
   8,
   9,
   10,
   11,
   12,
   13,
   14,
   15,
   16,
   17,
   18,
   19,
   20,
   21,
   22,
   23,
   24,
   25,
   26,
   27,
   28,
   29,
   30,
   31,
   32,
   33,
   34,
   35,
   36,
   37,
   38,
   39,
   40,
   41,
   42,
   43,
   44,
   45,
   46,
   47,
   48,
   49,
   50,
   51,
   52,
   53,
   54,
   55,
   56,
   57,
   58,
   59,
   60,
   61,
   62,
   63,
   64,
   65,
   66,
   67,
   68,
   69,
   70,
   71,
   72,
   73,
   74,
   75,
   76,
   77,
   78,
   79
  ],
  "logical_cpus": 80,
  "thread_env": {}
 },
 "label": "default test suite",
 "measurement": {
  "all_s": [
   211.44416953199834
  ],
  "median_s": 211.44416953199834,
  "min_s": 211.44416953199834,
  "p95_s": 211.44416953199834,
  "repeats": 1,
  "tail_rule": "max_of_1",
  "warmup": 0
 },
 "memory_report": {
  "after": {
   "cgroup_memory_bytes": 101715968,
   "cgroup_swap_bytes": 0,
   "host_swap_total_bytes": 2002545270784,
   "host_swap_used_bytes": 0,
   "mem_available_bytes": 390241050624,
   "mem_total_bytes": 405342146560,
   "monotonic_s": 103287.552581487,
   "rss_bytes": 30732288
  },
  "before": {
   "cgroup_memory_bytes": 20537344,
   "cgroup_swap_bytes": 0,
   "host_swap_total_bytes": 2002545270784,
   "host_swap_used_bytes": 0,
   "mem_available_bytes": 390303997952,
   "mem_total_bytes": 405342146560,
   "monotonic_s": 103076.10688166,
   "rss_bytes": 30732288
  },
  "cgroup_swap_after_bytes": 0,
  "cgroup_swap_before_bytes": 0,
  "host_reserve_bytes": 60801321984,
  "interval_s": 0.25,
  "min_mem_available_bytes": 387605311488,
  "peak_cgroup_swap_bytes": 0,
  "peak_rss_bytes": 30732288,
  "process_rss_budget_bytes": null,
  "samples": 844,
  "signal": "/sys/fs/cgroup/memory.swap.current",
  "signal_rationale": "container cgroup swap, not host swap: host swap is non-zero at rest on this machine (CHE-64), so a host-swap delta is not attributable to this run",
  "swap_delta_peak_bytes": 0,
  "verdict": {
   "breached": false,
   "detail": null,
   "limit_bytes": null,
   "observed_bytes": null,
   "reason": null
  }
 },
 "notes": [
  "One timed run, no warmup. Repeating a 3.5-minute suite three times to median it would cost ten minutes to sharpen a number whose useful resolution is 'did this grow by tens of seconds'.",
  "Run INSIDE the already-containerized process, so this measures the suite and not docker startup.",
  "Measured across a process boundary, so this process does not touch a device: initializing JAX here would preallocate ~78% of the card and leave the child to OOM on an allocation it has room for alone. The process boundary is the barrier, and `cuda` is null because a parent's allocator snapshot is not the child's peak -- read the demo's own record for its device memory."
 ],
 "peak_host_rss_bytes": 30732288,
 "stages": {
  "accounted_s": 211.4439,
  "fraction_of_total": {
   "subprocess": 1.0
  },
  "seconds": {
   "subprocess": 211.4439
  },
  "total_s": 211.4442,
  "unaccounted_s": 0.0003
 },
 "subprocess": {
  "argv": [
   "/usr/local/bin/python",
   "-m",
   "pytest",
   "-q",
   "tests"
  ],
  "peak_child_rss_bytes": 2692349952,
  "returncode": 0,
  "stderr_tail": [],
  "tail": [
   "SKIPPED [1] tests/test_gpu_environment.py:264: gpu tests need a dedicated session; 1179 non-gpu test(s) are also selected. On the GPU image every test in the process computes on the GPU, and the non-gpu tolerances were derived on the CPU. Run: `./run.sh --gpu pytest -q -m gpu`",
   "SKIPPED [1] tests/test_gpu_environment.py:338: gpu tests need a dedicated session; 1179 non-gpu test(s) are also selected. On the GPU image every test in the process computes on the GPU, and the non-gpu tolerances were derived on the CPU. Run: `./run.sh --gpu pytest -q -m gpu`",
   "SKIPPED [15] tests/test_metalens_bridge_gpu.py: gpu tests need a dedicated session; 1179 non-gpu test(s) are also selected. On the GPU image every test in the process computes on the GPU, and the non-gpu tolerances were derived on the CPU. Run: `./run.sh --gpu pytest -q -m gpu`",
   "SKIPPED [6] tests/test_precision_execution_matrix.py: gpu tests need a dedicated session; 1179 non-gpu test(s) are also selected. On the GPU image every test in the process computes on the GPU, and the non-gpu tolerances were derived on the CPU. Run: `./run.sh --gpu pytest -q -m gpu`",
   "SKIPPED [2] tests/test_precision_gpu_pipeline.py:160: gpu tests need a dedicated session; 1179 non-gpu test(s) are also selected. On the GPU image every test in the process computes on the GPU, and the non-gpu tolerances were derived on the CPU. Run: `./run.sh --gpu pytest -q -m gpu`",
   "SKIPPED [15] tests/test_precision_gpu_pipeline.py: gpu tests need a dedicated session; 1179 non-gpu test(s) are also selected. On the GPU image every test in the process computes on the GPU, and the non-gpu tolerances were derived on the CPU. Run: `./run.sh --gpu pytest -q -m gpu`",
   "SKIPPED [2] tests/test_precision_gpu_pipeline.py:230: gpu tests need a dedicated session; 1179 non-gpu test(s) are also selected. On the GPU image every test in the process computes on the GPU, and the non-gpu tolerances were derived on the CPU. Run: `./run.sh --gpu pytest -q -m gpu`",
   "1179 passed, 48 skipped, 3 warnings in 208.18s (0:03:28)"
  ]
 },
 "swap_growth_bytes": 0,
 "workload": {
  "detail": {},
  "route": "pytest -q tests",
  "size": 1.0,
  "unit": "suite_run"
 }
}
